<?xml version="1.0" encoding="UTF-8"?>
<!DOCTYPE interfaces
  PUBLIC '-//Atrinik//ADS-1 1.1.2//EN'
  'ads-1.dtd'>
<interfaces>
    <interface>
        <dialog name="hello">
            <message>I see someone has found their way down here. Tell me, what can my shipping company do for you?</message>
            <response destination="shipping" message="Shipping?"/>
            <response destination="questions" message="I have some questions..."/>
            <response action="close" message="Goodbye."/>
        </dialog>
        <dialog name="shipping">
            <message>Sure, we ship lots of goods for the right price.</message>
            <response destination="questions" message="I have some questions..."/>
            <response action="close" message="Goodbye."/>
        </dialog>
        <dialog name="questions">
            <message>Some questions have answers that people don't like. Unless you have some business here, you should probably go.</message>
            <response action="close" message="Goodbye."/>
        </dialog>
    </interface>
</interfaces>
