<?xml version="1.0" encoding="UTF-8"?>
<!DOCTYPE interfaces
  PUBLIC '-//Atrinik//ADS-1 1.1.2//EN'
  'ads-1.dtd'>
<interfaces>
    <interface>
        <dialog name="hello">
            <message>Hey! You don't look like one of my students...</message>
        </dialog>
        <dialog name="marisa" regex="marisa|kirisame|marisa kirisame">
            <message>Hey, I don't knock your hobbies.</message>
        </dialog>
        <dialog name="tsukino" regex="sailor moon|tsukino|usagi tsukino">
            <message>No, I won't do an &quot;In the name of the Moon&quot; speech for you. Go away.</message>
        </dialog>
    </interface>
</interfaces>
