<?xml version="1.0" encoding="UTF-8"?>
<!DOCTYPE interfaces
  PUBLIC '-//Atrinik//ADS-1 1.1.2//EN'
  'ads-1.dtd'>
<interfaces>
    <interface>
        <dialog name="hello">
            <message>Welcome, welcome... Heh-heh-heh...</message>
            <response destination="havetwo" message="Why do you have two brooms?"/>
        </dialog>
        <dialog name="havetwo">
            <message>That is none of your concern! Now go away before I get really mad!</message>
            <response destination="stealone" message="Did you steal one?"/>
        </dialog>
        <dialog name="stealone">
            <message>Keep it up, and you'll get more than you bargained for!</message>
            <response destination="stoleit" message="You stole it, didn't you."/>
        </dialog>
        <dialog name="stoleit">
            <say>Now you've done it!</say>
            <close/>
            <action enemy="player"/>
        </dialog>
    </interface>
</interfaces>
