<?xml version="1.0" encoding="UTF-8"?>
<!DOCTYPE interfaces
  PUBLIC '-//Atrinik//ADS-1 1.1.2//EN'
  'ads-1.dtd'>
<interfaces>
    <interface state="class">
        <and>
            <check options="classTime"/>
        </and>
        <dialog name="hello">
            <message>Hey. Listening to the teacher...</message>
        </dialog>
        <dialog name="alice" regex="alice|margatroid|alice margatroid">
            <message>Maybe later, I've really gotta pass this test.</message>
        </dialog>
    </interface>
    <interface state="club">
        <and>
            <check options="clubTime"/>
        </and>
        <dialog name="hello">
            <message>Too busy now. Trying to win against this cheater.</message>
            <response destination="cheating" message="Who is cheating?" npc="smug student witch"/>
        </dialog>
        <dialog inherit="hello" name="alice" regex="alice|margatroid|alice margatroid"/>
    </interface>
</interfaces>
